{
  "schema": "raf.ecosystem-runtime-map.v1",
  "generated_at": "2026-07-19T23:20:00Z",
  "coordinator": {
    "repository": "rafaelmeloreisnovo/RafGitTools",
    "branch": "codex/close-runtime-gaps-phase-1"
  },
  "policy": {
    "claim_allowed": false,
    "unknown_is_success": false,
    "file_presence_is_runtime": false,
    "certified_without_external_evidence": false
  },
  "repositories": [
    {
      "repository": "rafaelmeloreisnovo/RafGitTools",
      "default_branch": "main",
      "observed_ref": "bce8bc23638689205d286630c86ab19c36edaf10",
      "repository_size_kib": 8162,
      "role": "Android control plane, Git/GitHub operations, governance, BrowserRaf and document-ingestion coordinator",
      "state": "PARTIAL",
      "evidence": [
        "BrowserRaf/internal/br_start.S",
        "BrowserRaf/internal/br_tls.h",
        "schemas/document-completion.schema.json",
        "tools/document_completion_scan.py"
      ],
      "gaps": [
        "cross-repository job transport and recovery are not proved end to end",
        "BrowserRaf TLS is neither complete nor certified",
        "loose-file scanner has not produced a reviewed semantic patch"
      ],
      "next_actions": [
        "implement fail-closed CSPRNG/TLS provider boundary",
        "run document scan against one canonical document",
        "emit signed or hashed job evidence for Termux"
      ]
    },
    {
      "repository": "rafaelmeloreisnovo/llamaRafaelia",
      "default_branch": "master",
      "observed_ref": "56451b3df51aa579fa0041cda99590050bf5ac07",
      "repository_size_kib": 186651,
      "role": "bounded semantic interpreter and local model runtime over provenance-preserving segments",
      "state": "PARTIAL",
      "evidence": [
        "docs/RUNTIME_SEGMENT_CONTRACT.md",
        "docs/RAFAELIA_VECTRA_LAMA_CONNECTOR_BRIDGE.md",
        "runtime-lock.json"
      ],
      "gaps": [
        "the contract forbids raw-source ingestion but full RafGitTools-Termux-RafPolimata-Llama execution evidence is absent",
        "model weights, device memory budget and Android runtime matrix are not attached to this map"
      ],
      "next_actions": [
        "consume a deterministic sample segment bundle",
        "record model hash, memory peak and output anchoring",
        "prove rejection of raw unbounded inputs"
      ]
    },
    {
      "repository": "rafaelmeloreisnovo/Vectras-VM-Android",
      "default_branch": "master",
      "observed_ref": "54c70615c77772a3a7074fd297743f25936cb168",
      "repository_size_kib": 366448,
      "role": "Android VM application, Vectra runtime integration and QEMU artifact consumer",
      "state": "BLOCKED",
      "evidence": [
        "reports/CANONICAL_BUILD_STATUS.md",
        "docs/active/CODEX_CONTINUA_VECTRAS_RUNTIME_GATE.md",
        "app/build.gradle"
      ],
      "gaps": [
        "canonical validated SHA is older than the observed ref",
        "current commit has no canonical CI validation recorded",
        "release remains BETA_BLOCKED and device runtime evidence is incomplete"
      ],
      "next_actions": [
        "run the canonical JDK21 assembleDebug command on the observed ref",
        "consume the QEMU artifact contract",
        "record install, launch and VM smoke evidence"
      ]
    },
    {
      "repository": "rafaelmeloreisnovo/termux-app-rafacodephi",
      "default_branch": "master",
      "observed_ref": "037efb4d1c4fa42dce6153df508c591814dfeb9e",
      "repository_size_kib": 27394,
      "role": "local Android execution plane, package/bootstrap runtime, APK build and native toolchain host",
      "state": "BLOCKED",
      "evidence": [
        "docs/RUNTIME_TRUTH_TABLE.md",
        "scripts/build_apk_matrix.sh",
        "scripts/build_real_arm_bootstrap_core.py",
        "scripts/device_runtime_smoke.sh"
      ],
      "gaps": [
        "real package payload is blocked by LEGACY_PREFIX_BINARY_RISK in upstream ELFs",
        "pkg, apt, dpkg, proot, certificates and network remain unproved on device",
        "a project APK build is proved but a universal multi-language source-to-APK compiler is not"
      ],
      "next_actions": [
        "rebuild dependency closure for the RAFCODEPhi prefix",
        "run DEVICE_REAL_PKG_VALIDATED on ARM32 and ARM64",
        "separate APK project build evidence from language compiler claims"
      ]
    },
    {
      "repository": "rafaelmeloreisnovo/qemu_rafaelia",
      "default_branch": "master",
      "observed_ref": "8e4cf4e377386abbaac386949889e7546f322841",
      "repository_size_kib": 627699,
      "role": "virtual machine engine and producer of contract-packaged qemu-system artifacts",
      "state": "PARTIAL",
      "evidence": [
        ".github/workflows/ci-build.yml",
        "tools/rafaelia/package_qemu_artifact.sh",
        "tools/rafaelia/check_qemu_artifact_contract.sh",
        "PR #57"
      ],
      "gaps": [
        "the workflow is wired but a green build and downloadable artifact are not attached here",
        "Android/Termux execution and Vectra consumption are not proved end to end",
        "build targets do not by themselves prove guest boot or hardware acceleration"
      ],
      "next_actions": [
        "capture successful multi-target workflow evidence",
        "verify artifact hashes and manifests",
        "boot a minimal guest through the Vectra consumer path"
      ]
    },
    {
      "repository": "rafaelmeloreisnovo/androidx_RmR",
      "default_branch": "androidx-main",
      "observed_ref": "91795d4969c8e69e6bca78bf9834e3c20d77dd4e",
      "repository_size_kib": 1070678,
      "role": "AndroidX fork plus isolated RmR native/matrix extension module",
      "state": "PARTIAL",
      "evidence": [
        "rmr/rafaelia/build.gradle",
        "rmr/rafaelia/src/main/cpp/CMakeLists.txt",
        "rmr/rafaelia/src/main/cpp/rafaelia_core.cpp",
        "settings.gradle"
      ],
      "gaps": [
        "published performance and memory claims require current reproducible benchmark artifacts",
        "QEMU/Termux/Vectra interoperability is not proved by module presence",
        "upstream AndroidX and RmR extension boundaries need continuous license and build verification"
      ],
      "next_actions": [
        "run isolated module tests and benchmarks",
        "publish exact environment and result JSON",
        "build a minimal consumer app without modifying AndroidX defaults"
      ]
    },
    {
      "repository": "rafaelmeloreisnovo/gradle",
      "default_branch": "master",
      "observed_ref": "8ed9a557db78f52c13ccab34a152af79313fa1f6",
      "repository_size_kib": 647823,
      "role": "build engine fork with isolated vectra-orchestrator module and backend selection",
      "state": "PARTIAL",
      "evidence": [
        "platforms/native/vectra-orchestrator/README.md",
        "platforms/native/vectra-orchestrator/src/main/java/org/gradle/vectra/runtime/JavaPureVectraEngine.java",
        "platforms/native/vectra-orchestrator/src/main/asm/vectra_pulse.S"
      ],
      "gaps": [
        "ASM implementation is currently x86_64 only",
        "AArch64 uses native C or pure Java fallback",
        "capability detection is partly architecture/hint based rather than native instruction probing",
        "cross-repository Android build is not proved by the module alone"
      ],
      "next_actions": [
        "add AArch64 ASM only with ABI tests or keep explicit fallback",
        "run vectraPerfBenchmark and vectraPerfGate",
        "consume AndroidX/Vectra test fixtures in an isolated integration build"
      ]
    }
  ],
  "external_dependencies": [
    {
      "id": "external:rafaelmeloreisnovo/RafPolimata",
      "role": "strict ELF/DEX/APK compiler-verifier work, source segmentation and evidence production",
      "state": "PARTIAL",
      "reason": "Required by current RafGitTools and Llama contracts but outside this first branch."
    },
    {
      "id": "external:Android-SDK-NDK-ART",
      "role": "official Android build, signing, DEX inspection, installation and runtime environment",
      "state": "REFERENCE",
      "reason": "External toolchain evidence must be pinned per build and device."
    }
  ],
  "capabilities": [
    {
      "id": "browser_asm",
      "state": "PARTIAL",
      "repositories": ["rafaelmeloreisnovo/RafGitTools"],
      "evidence": ["BrowserRaf/internal/br_start.S", "BrowserRaf/internal/br_main.c"],
      "gap": "No current ARM32/ARM64 device run or browser conformance suite is attached.",
      "gate": "Build, hash and execute smoke vectors on both target ABIs."
    },
    {
      "id": "tls_1_3",
      "state": "BLOCKED",
      "repositories": ["rafaelmeloreisnovo/RafGitTools"],
      "evidence": ["BrowserRaf/internal/br_tls.h"],
      "gap": "ClientHello and record parsing exist, but deterministic entropy and missing cryptographic handshake make HTTPS unsafe.",
      "gate": "CSPRNG, X25519, HKDF, transcript, certificate/hostname validation, Finished and AEAD interoperability must pass."
    },
    {
      "id": "tls_1_2",
      "state": "DESIGN",
      "repositories": ["rafaelmeloreisnovo/RafGitTools"],
      "evidence": ["BrowserRaf/internal/br_tls.h:TLS_VER_12"],
      "gap": "A version constant is not a TLS 1.2 implementation.",
      "gate": "Declare unsupported or pass a separately implemented interoperability profile."
    },
    {
      "id": "apk_project_build",
      "state": "PASS",
      "repositories": ["rafaelmeloreisnovo/termux-app-rafacodephi"],
      "evidence": ["docs/RUNTIME_TRUTH_TABLE.md", "scripts/build_apk_matrix.sh"],
      "gap": "This PASS applies to the project APK build contract, not arbitrary language-to-APK compilation.",
      "gate": "Preserve the narrower claim and attach the produced APK evidence to releases."
    },
    {
      "id": "apk_multilanguage_compiler",
      "state": "PARTIAL",
      "repositories": ["rafaelmeloreisnovo/RafGitTools", "rafaelmeloreisnovo/termux-app-rafacodephi"],